Sheet: ProjMarksheetT1-2024-v1
A1: COIT20246 2023 T3 Project
A2: Group | B2: MEL42
A3: Marker | B3: Sunil Seneviratne
A4: Repository URL | B4: https://github.com/cquict/coit20246y24t1-project-mel-priyanka-prem
A5: Student 1 (ID & Name) | B5: 12255873; Prem Gaurangkumar PATEL
A6: Student 2 | B6: 12267145; Priyanka NARSAREDDYNOOR
A7: Student 3 | B7: -
A9: Project Draft Score
A10: Sub-total | B10: =R[13]C+R[18]C+R[24]C+R[30]C+R[36]C -> 7.25
A11: Days late | B11: 0
A12: Late penalty (5%, 0.6 marks per day) | B12: =0.6*R[-1]C -> 0
A13: Total | B13: =MAX(R[-3]C-R[-1]C,0) -> 7.25 | C13: out of 12
A15: Project Final Score
A16: Sub-total | B16: =R[37]C+R[43]C+R[49]C+R[55]C+R[61]C+R[67]C+R[73]C+R[79]C -> 5.5
A17: Days late | B17: 0
A18: Late penalty (5%, 0.9 marks per day) | B18: =0.9*R[-1]C -> 0
A19: Total | B19: =MAX(R[-3]C-R[-1]C,0) -> 5.5 | C19: out of 18
A21: Project Part 1
A22: Diagram and justification | B22: Good | C22: Excellent | D22: Good | E22: Satisfactory | F22: Weak | G22: Poor
B23: =HLOOKUP(R[-1]C,R[-1]C[1]:RC[5],2,FALSE) -> 4 | C23: 6 | D23: 4 | E23: 3 | F23: 2 | G23: 0
C24: DIAGRAMS: Excellent work. One or more clear and complete network diagrams (at least one logical network diagram) of the design of entire network (e.g. using diagrams.net); all suitable icons used with appropriate symbols/ labels (e.g. no arrowheads for connecting lines, clear connection point to Internet); all clear and well organised; AND Appropriate use of sub-networks to separate different user categories. Correct use of only /24 or /16 or both address blocks. AND Adequate and clear justification for identified sub-networks. EXPLANATION: Explanation of key design decisions, (e.g., why you chose to design as you did). AND Includes justification for all sub-nets, devices and services used AND Provided clear, direct, focused, complete, well organised explanation. Not terse nor verbose. | D24: DIAGRAMS: Good, not Excellent but better than Satisfactory. Generally clear and well organised. One or more network diagrams (at least one logical network diagram) of the design of entire network (e.g. using diagrams.net); AND appropriate number of sub-networks correctly identified; BUT incomplete diagrams without serious errors; may have some missing components/connections, non-standard/unsuitable icons/symbols, missing/unclear labels; some weakness (e.g. has poor topology); OR incorrect use of only /24 or /16 or both address blocks; EXPLANATION: Good, not Excellent. Explanation mostly clear and focused, sufficient elaboration, with few omissions or errors; AND includes justification for all sub-nets, devices and services used. | E24: DIAGRAMS: Satisfactory but not sufficiently Good. Network diagrams provided but incomplete; some unsuitable, unclear, missing components, information, contain limited errors (e.g. PC to PC connection, wrong devices, wrong/unsuitable connections). AND adequate number of sub-networks correctly identified; BUT incorrect use of only /24 or /16 or both address blocks; EXPLANATION: Satisfactory but not sufficiently Good. Some unclear or unfocused explanation, inadequate elaboration, terse or verbose writing; some omissions or errors; AND includes justification for at most but not all of the sub-nets, devices and services used. | F24: DIAGRAMS: Not passable; unusable or inadequate network diagram. Network diagrams provided but unclear, missing multiple key components, incomplete information. OR contain serious errors (missing or wrong components/connections); OR has inadequate number of sub-networks. EXPLANATION: Generally disorganised, unfocused, unclear, disjointed, incomplete, missing several key information or has many errors; OR has justification for only some of the sub-nets, devices and services used. | G24: DIAGRAMS: No network diagrams given OR not related to the project scenario OR many errors indicating not following the unit content. EXPLANATION: None given OR not related to the project scenario.
B25: Note: | C25: Source .drawio files (created in draw.io/diagrams.net) are required to achieve more than Weak.
B26: Comments: | C26: Although couple of diagrams were provided, missing key information such as subnet address/mask details in all of them. Justification lacks details in device selection.
A27: Wi-Fi | B27: Good | C27: Excellent | D27: Good | E27: Weak | F27: Poor
B28: =HLOOKUP(R[-1]C,R[-1]C[1]:RC[4],2,FALSE) -> 1.5 | C28: 2 | D28: 1.5 | E28: 0.75 | F28: 0
C29: Excellent work. Important Wi-Fi design issues considered, including but not limited to: number of access points; channels/frequencies; standards; AND All Wi-Fi issues considered are specific and relevant to the scenario and network diagram(s); AND Clear and focused explanation, with specific values given. | D29: Not Excellent but better than Weak. Minor issues missed or wrong in Wi-Fi design, but mostly Good. AND All Wi-Fi issues considered are specific and relevant to the scenario and network diagram(s); AND Clear and focused explanation, with specific values given. | E29: Weak. Several issues wrong or missing in Wi-Fi design; OR Multiple items presented are generic, and not referring to specific parts of the scenario or network diagram(s); OR Unclear or unfocused explanation. | F29: Most of the design decisions are wrong, missing or too generic.
B30: Note: | C30: Specific values for common Wi-Fi parameters are required to achieve more than Poor
B31: Comments: | C31: How Wi-Fi coverage was achieved, what devices/how many of them were used etc. was not described. No subnet address details were given.
A33: Addressing | B33: Weak | C33: Excellent | D33: Good | E33: Weak | F33: Poor
B34: =HLOOKUP(R[-1]C,R[-1]C[1]:RC[4],2,FALSE) -> 0.75 | C34: 2 | D34: 1.5 | E34: 0.75 | F34: 0
C35: Excellent work. Address allocations, e.g., table of IPv4 address ranges to be used, devices allocated; complete, consistent and clear. AND Correct use of only /24 or /16 or both address blocks; unambiguous mask information provided; AND sufficient and complete for all connected devices correctly identified, with suitable spare address blocks in reserve; AND clear presentations of the information (e.g. table and/or headings) | D35: Not Excellent but better than Weak. Most address blocks correctly identified but with some errors or incomplete. AND Imperfect use of only /24 or /16 or both address blocks; BUT have some ambiguous mask information provided; OR have some incorrect or incomplete connected devices identified, did not consider suitable spare address blocks in reserve; OR not a clear presentation of the information (e.g. table used but not clearly organised/categorised). | E35: Weak. Did not adequately identify required address blocks, contain many significant errors, not suitably organised or disjointed. OR Use of other than required /24 or /16 address blocks; OR inadequate/missing mask information; OR multiple key/representative devices without required address allocated; OR Table not used to present information. | F35: None given OR not related to the project scenario OR many mistakes demonstrating not following unit content.
B36: Note: | C36: IP address must be within the appropriate ranged based on the student ID (and not private addresses, like 192.168.x.y) to achieve more than Weak.
B37: Comments: | C37: Did not adequately identify required address blocks within the range based on last two digits of the student ID. Student IDs are 12267145 and 12255873. Selected subnets are 71.45.x.x and 58.73.x.x. No justification on using /24 mask on all subnets.
A39: List of equipment | B39: Poor | C39: Excellent | D39: Satisfactory | E39: Poor
B40: =HLOOKUP(R[-1]C,R[-1]C[1]:RC[3],2,FALSE) -> 0 | C40: 1 | D40: 0.5 | E40: 0
C41: Excellent work. Table of recommended hardware, e.g., recommended minimum specifications for equipment. Suitable and Complete key specifications (at least: Item type, manufacturer, model, no. of ports, speed, cost, quantity, where applicable - e.g. cables are generic); AND Information is presented clearly (e.g. table, list, headings) and with consistent units. | D41: Not Excellent but better than Poor. Most required network hardware identified, but missing some or incomplete key specifications (e.g. Item type, manufacturer, model, no. of ports, speed, cost, quantity, etc.); OR information not presented clearly and/or inconsistent units. | E41: None given OR not related to the project scenario ; OR incomplete/missing multiple key equipment/specifications.
B42: Note: | C42: Links to websites that contains specifications or prices of the devices recommended are required to achieve more than Poor.
B43: Comments: | C43: See the Note above. Links to websites containing required details were not included.
A45: Project plan | B45: Excellent | C45: Excellent | D45: Satisfactory | E45: Poor
B46: =HLOOKUP(R[-1]C,R[-1]C[1]:RC[3],2,FALSE) -> 1 | C46: 1 | D46: 0.5 | E46: 0
C47: Group is formed, registered with GitHub repository created before deadline; posted specific communication plan and allocation of tasks AND Regular use of Git commits by all contributing members during project. | D47: Group is formed, registered with GitHub repository created before deadline; some aspects of the communication plan or task list are missing or clearly wrong; AND Regular use of Git commits by all contributing members during project. | E47: Group not formed, registered with GitHub repository created before deadline; OR missing or incomplete specific communication plan and allocation of tasks. OR Infrequent Git commits by all members of project.
B48: Note: | C48: Regular Git commits by all contributing members are required to achieve more than Poor.
B49: Comments: | C49: Most tasks were included in the plan.
A51: Project Part 2
A52: Pricing for cloud services | B52: Weak | C52: Excellent | D52: Good | E52: Satisfactory | F52: Weak | G52: Poor
B53: =HLOOKUP(R[-1]C,R[-1]C[1]:RC[5],2,FALSE) -> 0.5 | C53: 2 | D53: 1.5 | E53: 1 | F53: 0.5 | G53: 0
C54: Appropriate services identified, selected and well justified in the context of the design. Presented annual prices from two providers. Evidence is clear (e.g. name of CSP: Cloud Service Provider, service type, cost, quantity, etc.); AND the virtual machines and select specifications are well justified, e.g. why web server and backup server have different specifications. AND Information is presented clearly (e.g. table, list, headings) and export from cloud service provider is included. | D54: Not Excellent but better than Satisfactory. Correct services identified, selected and justified in the context of the design. Annual prices from two providers. BUT Some incomplete information; OR unclear but mostly consistent basis for comparison. OR Some aspects of justifications are not clear or appropriate. | E54: Some incorrect services identified, weak or incomplete justification of services selected; some missing information, unclear annual prices from one provider; OR some inconsistent basis for comparison; OR some of the specifications chosen not suitable for the scenario, e.g. VM sizes OR Information not presented clearly. | F54: Unclear or missing selection justification OR missing significant comparison information OR only one supplier identified. | G54: None given OR not related to the project scenario OR many poorly justified and inappropriate services/specifications.
B55: Note: | C55: Official calculator from AWS, Azure or Google Cloud must be used AND export from the calculator included in repository is required to achieve more than Weak.
B56: Comments: | C56: Official calculators for price estimates were not included in GitHub repository, and no screenshots either.
A58: Backup strategies | B58: Weak | C58: Excellent | D58: Good | E58: Satisfactory | F58: Weak | G58: Poor
B59: =HLOOKUP(R[-1]C,R[-1]C[1]:RC[5],2,FALSE) -> 1 | C59: 3 | D59: 2 | E59: 1.5 | F59: 1 | G59: 0
C60: Excellent work. Analysis and discussion on (a) local backup only, is appropriate; (b) cloud services backup services suitably selected, and well justified in the context of the design. (c) non-cloud backup option is adequate; (d) Personal approaches clearly explained and justified, including organisation of files and tool to backup; AND Backup strategy selection is clear, relevant, specific. AND Explanation is well organised, clear, focused and not verbose; refers to specific, relevant tools and techniques, where applicable. | D60: Good attempt, not Excellent but better than Satisfactory: Some minor unclear or missing parts of answer | E60: Satisfactory but not Good: Recommended approach is missing an important part; OR Comparison with local backup is poor; OR Personal approach is missing an important part; OR Explanation is terse or too verbose, unclear in multiple parts. | F60: Backup approach for company is not well justified or explained clearly OR Personal approach is not well justified or explained clearly; OR Most of the answer is lacking specifics, and is only a general discussion; generic or typical of AI responses; OR Very poor explanation with multiple mistakes. | G60: None given OR not related to the project scenario OR many wrong or poorly explained issues.
B61: Note: | C61: The score for this item is based on the Report and the Presentation. Both must be submitted and cover this item to achieve more than Poor.
B62: Comments: | C62: Most of the answer is lacking specifics, and is only a general discussion. For cost comparison no evidences were given from the official calculators. Mostly generic and typical of AI responses.
A64: Risk Assessment | B64: Weak | C64: Excellent | D64: Good | E64: Satisfactory | F64: Weak | G64: Poor
B65: =HLOOKUP(R[-1]C,R[-1]C[1]:RC[5],2,FALSE) -> 1 | C65: 3 | D65: 2 | E65: 1.5 | F65: 1 | G65: 0
C66: Excellent work. Methodology applied correctly using spreadsheet; AND All assets and vulnerabilities are relevant; AND At least 1 asset from each asset type; AND At least 4 different data assets; AND At least 8 different information security threats covered. | D66: Methodology applied correctly using spreadsheet; AND All but 1 or 2 assets and vulnerabilities are relevant AND At least 1 asset from each asset type; AND At least 4 different data assets; AND At least 8 different information security threats covered. | E66: Methodology applied correctly using spreadsheet; AND Some assets or vulnerabilities are not relevant OR Not quite meeting one of the other requirement (i.e. each asset type OR data asset OR information security threats) | F66: Spreadsheet used but incomplete application of methodology OR Many assets or vulnerabilities not relevant; OR Missing several of the asset types, data assets or information security threats. | G66: None given OR did not use the risk assessment spreadsheet; OR Mostly irrelevant assets and vulnerabilities; OR Missing many of the asset types, data assets or information security threats.
B67: Note: | C67: Risk assessment template from unit must be used, with completed spreadsheet submitted to achieve more than Poor
B68: Comments: | C68: Some vulnerabilities listed are not for the identified assets, for example, 'photos' as asset and 'Someone branks into house and steals server PC with all photos' as vulnerability. In TVA matrix many missing entries; only 3 vulnerabilities considered out of the 12.
A70: Security controls | B70: Weak | C70: Excellent | D70: Good | E70: Satisfactory | F70: Weak | G70: Poor
B71: =HLOOKUP(R[-1]C,R[-1]C[1]:RC[5],2,FALSE) -> 1 | C71: 3 | D71: 2 | E71: 1.5 | F71: 1 | G71: 0
C72: Excellent work. Appropriate and complete data asset selected; AND Detailed, correct and complete explanation of how all security controls reduce the risk for the asset; AND Details of how all security controls can be used in the project scenario (e.g. refers to relevant devices, data and users, recommends specific technologies or approaches, as opposed to listing several approaches); AND Disadvantages from perspective of users are clear and relevant; AND Clear and focussed explanation. Not terse nor verbose. Suitable paragraphs used. | D72: Good attempt but not Excellent, with minor mistakes or unclear answers in: One of the security controls OR One of the disadvantages OR Poor presentation, e.g. weak use of paragraphs. | E72: Satisfactory but not Good, with several mistakes or unclear answers in: One or two of the security controls OR One of the disadvantages. | F72: Security controls for appropriate data asset explained with some minor issues, but disadvantages not given; OR Multiple mistakes in application of security controls (disadvantages are ok); OR Mostly unclear, verbose or unfocused explanations, not referring to specific parts of project scenario. | G72: Data asset not selected; OR Mostly wrong use of security controls OR Mostly irrelevant or generic answers with no connection to project scenario.
B73: Note: | C73: The score for this item is based on the Report and the Presentation. Both must be submitted and cover this item to achieve more than Poor.
B74: Comments: | C74: Some are generic details. Any disadvantages of introducing the controls from the perspective of the users were not addressed.
A76: Ethics: Data collection/use | B76: Poor | C76: Excellent | D76: Good | E76: Weak | F76: Poor
B77: =HLOOKUP(R[-1]C,R[-1]C[1]:RC[4],2,FALSE) -> 0 | C77: 1.5 | D77: 1 | E77: 0.75 | F77: 0
C78: Excellent analysis and discussion on data collection/use are clear, relevant, specific, complete; WITH relevant issues identified in data type & quantity collected, processing, access, use, distribution; AND Explanation is well organised, clear, focused and not terse nor verbose; references given where required. Suitable paragraphs used. | D78: Good attempt but not excellent. Similar to features in "Excellent" with all or most issues identified; BUT terse or not adequately elaborated; OR with Some minor unclear or incomplete/missing parts of answer; OR Weak use of paragraphs. | E78: Lacking substantial quality analysis and identification of relevant issues, OR Not well justified or explained clearly; OR Very poor explanation with multiple mistakes; OR Single /poor use of paragraphs. OR Reference not given, where required. | F78: None given OR not related to the project scenario; OR many wrong or poorly explained issues or most of the answer is lacking specifics; OR generic or only a general discussion;
B79: Note: | C79: Generic answers, but not limited to typical of IA generated responses, cannot achieve more than Poor.
B80: Comments: | C80: General discussion, most of the answer is lacking specifics, not related to the project scenario.
A82: Ethics: Security cameras | B82: Poor | C82: Excellent | D82: Good | E82: Weak | F82: Poor
B83: =HLOOKUP(R[-1]C,R[-1]C[1]:RC[5],2,FALSE) -> 0 | C83: 1.5 | D83: 1 | E83: 0.75 | F83: 0
C84: Excellent analysis and discussion on security camera issues are clear, relevant, specific, complete; WITH relevant issues identified for security cameras, viz. the surveillance locations, retention duration in archive, access, use, distribution; AND Explanation is well organised, clear, focused and not terse nor verbose; references given where required. Suitable paragraphs used. | D84: Good attempt but not excellent. Similar to features in "Excellent" with all or most issues identified; BUT terse or not adequately elaborated; OR with Some minor unclear or incomplete/missing parts of answer; OR Weak use of paragraphs. | E84: Lacking substantial quality analysis and identification of relevant issues, OR Not well justified or explained clearly; OR Very poor explanation with multiple mistakes; OR Single /poor use of paragraphs. OR Reference not given, where required. | F84: None given OR not related to the project scenario; OR many wrong or poorly explained issues or most of the answer is lacking specifics; OR generic or only a general discussion;
B85: Note: | C85: Generic answers, but not limited to typical of IA generated responses, cannot achieve more than Poor.
B86: Comments: | C86: General discussion, most of the answer is lacking specifics, not related to the project scenario. No discussion on relevant local or laws/regulations governing using security cameras.
A88: Project reflection | B88: Weak | C88: Excellent | D88: Good | E88: Weak | F88: Poor
B89: =HLOOKUP(R[-1]C,R[-1]C[1]:RC[4],2,FALSE) -> 1 | C89: 2 | D89: 1.5 | E89: 1 | F89: 0
C90: Appropriate and demonstrates genuine reflection and identified practical/useful techniques for the future. Report includes a statement of contributions. Focused, clear, well organised and not terse nor verbose. Suitable paragraphs used. | D90: Good attempt, not Excellent but better than Weak. Mostly appropriate, demonstrates genuine reflection and identified some practical/useful techniques for the future. Report includes a statement of contributions. Generally focused and clear; OR Single / weak use of paragraphs. | E90: Generally appropriate, limited reflection and limited identification of practical/useful techniques for the future. Report includes a statement of contributions. Lacking focus, organisational clarity. Terse or verbose. | F90: None given OR not related or appropriate to demonstrate genuine reflection and did not identify practical/useful techniques for the future. Did not includes a statement of contributions; OR generic discussion or typical of AI generated response.
B91: Note: | C91: The score for this item is based on the Report and the Presentation. Both must be submitted and cover this item to achieve more than Poor.
B92: Comments: | C92: Limited reflection and limited identification of individual tasks done by members. No clear and genuine discussion on practical/useful techniques for the future.
A94: Project professionalism | B94: Satisfactory | C94: Excellent | D94: Good | E94: Satisfactory | F94: Weak | G94: Poor
B95: =HLOOKUP(R[-1]C,R[-1]C[1]:RC[5],2,FALSE) -> 1 | C95: 2 | D95: 1.5 | E95: 1 | F95: 0.5 | G95: 0
C96: Regular use of Git commits by all contributing members during project; AND Template followed for report (e.g. .md files used) AND Professional written report, including good use of section headings, appropriate use of paragraphing and diagrams; focused (not terse nor verbose); clear writing; AND Recorded presentation is clear and meets requirements (e.g. all students speak, duration appropriate) | D96: Good attempt but not excellent: Regular use of Git commits by all contributing members during project; AND Template followed for report (e.g. .md files used) AND (Some minor issues with written report e.g. minor formatting or presentation issues OR Some minor issues with recorded presentation e.g. minor issues with audio or quality.) | E96: Similar to good, but a few more issues with the written report, e.g. multiple formatting or presentation problems. | F96: Both members contributed to GitHub, but some weeks had no commits or less frequent than expected earlier in project OR Multiple problems in presentation of the report. | G96: No regular contributions to GitHub (e.g. very sporadic or only contributions in week or two leading up to deadline) OR One student made almost all contributions to GitHub; OR Template not followed for report (e.g. upload a Word doc to GitHub) OR Very poorly presented report OR No recorded presentation, or did not meet most requirements of presentation.
B97: Note: | C97: The score for this item is based on the Report and the Presentation. Both must be submitted and cover this item to achieve more than Poor.
B98: Comments: | C98: Presentation: 7.26 mins.; exceeding the time. Presentation needs improvement; not directly addressing the tasks given in the section. The contents in the slides used were not related to the topics presented.

Sheet: Weights-T1,2024
C4: Project Part 1
C5: Diagram & Justification | D5: 6
C6: WiFi | D6: 2
C7: Addressing | D7: 2
C8: List of equipment | D8: 1
C9: Project plan | D9: 1
C10: total Part 1 | D10: =SUM(R[-5]C:R[-1]C) -> 12
C12: Project Part 2
C13: *Pricing for cloud services | D13: 2
C14: Backup strategies | D14: 3
C15: Risk assessment | D15: 3
C16: Security controls | D16: 3
C17: *Ethics | D17: 3
C18: Project reflection | D18: 2
C19: *Project professionalism | D19: 2
C20: total Part 2 | D20: =SUM(R[-7]C:R[-1]C) -> 18